country,2000,2001,2002,2003,2004,2005,2006,2007,2008,2009,2010,2011,2012,2013,2014,2015,2016,,Notes 2000,Source 2000,Notes 2001,Source 2001,Notes 2002,Source 2002,Notes 2003,Source 2003,Notes 2004,Source 2004,Notes 2005,Source 2005,Notes 2006,Source 2006,Notes 2007,Source 2007,Notes 2008,Source 2008,Notes 2009,Source 2009,Notes 2010,Source 2010,Notes 2011,Source 2011,Notes 2012,Source 2012,Notes 2013,Source 2013,Notes 2014,Source 2014,Notes 2015,Source 2015,Notes 2016,Source 2016
Guam,16.11,25.38,31.19,33.72,36.16,38.56,43.85,46.15,48.42,50.64,54.04,57.7,61.53,65.4,69.27,73.14,77.01,10.6,,Guam Telephone Authority.,,Guam Telephone Authority.,,Guam Telephone Authority.,,Guam Telephone Authority.,,Guam Telephone Authority.,,Guam Telephone Authority.,,ITU estimate.,,ITU estimate.,,ITU estimate.,,ITU estimate.,,ITU estimate.,,ITU estimate.,,ITU estimate.,,ITU estimate.,,ITU estimate.,,ITU estimate.,,ITU Estimate.
Guatemala,0.71,1.74,3.39,4.55,5.1,5.7,6.5,7.3,8.3,9.3,10.5,12.3,16,19.7,23.4,28.81,34.51,10.6,,,,,,,,,,,,,,ITU estimate.,,ITU estimate.,,ITU estimate.,,ITU estimate.,,ITU estimate.,,ITU estimate.,,ITU estimate.,,ITU estimate.,,ITU estimate.,,ITU Estimate.,,ITU Estimate.
Guernsey,31.9,44.47,53.57,59.14,64.52,73.57,83.63,,,,,83.63,,,,,,10.6,,Cable & Wireless Guernsey.,,Cable & Wireless Guernsey.,,CRC based on survey.,,Cable & Wireless Guernsey.,,2004 HH ICT survey.,,Cable & Wireless Guernsey.,,Cable & Wireless Guernsey.,,,,,,,,,,ITU estimate.,,,,,,,,,,
Guinea,0.1,0.18,0.4,0.45,0.51,0.54,0.64,0.78,0.92,0.94,1,2,3.1,4.5,6.4,8.2,9.8,10.6,,,,,,,,,,,,,,,,Ministère de la Communication et des Nouvelles Technologies de l'Information.,Based on operators' information.,Ministère de la Communication et des Nouvelles Technologies de l'Information,Based on operators' information.,Ministère de la Communication et des Nouvelles Technologies de l'Information,,ITU estimate.,,ITU estimate. ,,ITU estimate.,,ITU estimate.,,ITU estimate.,,ITU Estimate.,,ITU Estimate.
Guinea-Bissau,0.23,0.3,1.02,1.35,1.81,1.9,2.06,2.21,2.35,2.3,2.45,2.67,2.89,3.1,3.32,3.54,3.76,10.6,,,,,,,,,,,,,,,,ITU estimate.,,Instituto das Comunicaçoes da Guiné-Bissau.,,Instituto das Comunicaçoes da Guiné-Bissau.,,ITU estimate.,,ITU estimate.,,ITU estimate.,,ITU estimate.,,ITU estimate.,,ITU estimate.,,ITU Estimate.
Guyana,6.61,13.21,,,,,,13.8,18.2,23.9,29.9,30,30.5,31,32,34,35.66,10.6,,,,,,,,,,,,,,,,ITU estimate.,,National Frequency Management Unit,,National Frequency Management Unit,,National Frequency Management Unit,,ITU estimate.,,ITU estimate.,,ITU estimate.,,ITU estimate.,,ITU estimate.,,ITU Estimate.
Haiti,0.23,0.34,0.89,1.65,5.4,6.38,6.8,7.2,7.6,8.1,8.37,9,9.8,10.6,11.4,12.2,12.23,10.6,,,,,,,,ITU estimate.,,ITU estimate.,,ITU estimate.,,ITU estimate.,,ITU estimate.,,ITU estimate.,,ITU estimate.,,ITU estimate.,,ITU estimate.,,ITU estimate.,,ITU estimate.,,ITU estimate.,,ITU estimate.,,ITU Estimate.
Honduras,1.2,1.42,2.6,4.8,5.6,6.5,7.8,9.4,9.6,9.8,11.09,15.9,18.12,17.8,19.08,27.62,30,10.6,,,,,,,Estimated based on Survey's results. Population age 5+.,ITU estimate.,Population age 5+.,"ITU based on ECLAC, OSILAC.",Population age 5+.,"ITU based on ECLAC, OSILAC.",Population age 5+.,ITU estimate.,Population age 5+.,"ITU based on ECLAC, OSILAC.",Population age 5+.,Instituto Nacional de Estadistica de Honduras (INE),Estimated based on Survey's results. Population age 5+.,ITU estimate.,,Comisión Nacional de Telecomunicaciones (CONATEL),Estimated based on Survey's results. Population age 5+.,Comisión Nacional de Telecomunicaciones (CONATEL),,Instituto Nacional de Estadistica,,Instituto Nacional de Estadistica,,ITU estimate.,,ITU Estimate.,,ITU Estimate.
"Hong Kong, China",27.83,38.67,43.08,52.2,56.4,56.9,60.8,64.8,66.7,69.4,72,72.2,72.9,74.2,79.87,84.95,87.48,10.6,Population age 10+ who accessed Internet in previous year.,Census and Statistics Department,Population age 10+ who accessed Internet in previous year.,Census and Statistics Department,Population age 10+ who accessed Internet in previous year.,Census and Statistics Department,Population age 10+ who accessed Internet in previous year.,Census and Statistics Department,Population age 10+ who accessed Internet in previous year.,Census and Statistics Department,Population age 10+.,Census and Statistics Department.,Population age 10+.,Census and Statistics Department.,Population age 10+.,Census and Statistics Department.,Population age 10+.,Census and Statistics Department.,Population age 10+.,Census and Statistics Department.,Population age 10+.,Office of the Telecommunications Authority,Population age 10+.,ITU estimate.,All persons aged 10 and over,Census and Statistics Department,All persons aged 10 and over,Census and Statistics Department,Population age 10+.,Census and Statistics Department,Population age 10+.,Census and Statistics Department,,Census and Statistics Department.
Hungary,7,14.53,16.67,21.63,27.74,38.97,47.06,53.3,61,62,65,68.02,70.58,72.64,75.65,72.83,79.26,10.6,,National Communications Authority.,,National Communications Authority.,,National Communications Authority.,,National Communications Authority.,,ITU estimate based on Eurostat.,Population age 16-74.,Eurostat.,Population age 16-74.,Eurostat.,Population age 16-74.,Eurostat.,Population age 16-74.,"Eurostat.
",Population age 16-74.,Eurostat.,Population age 16-74.,Eurostat., Users in the last 3 months. Age 16-74.,Eurostat., Users in the last 3 months.,Eurostat.,Population age 16-74.,Eurostat.,Population age 16-74.,Eurostat,Population age 16-74.,Eurostat.,,Eurostat.
Iceland,44.47,49.39,79.12,83.14,83.88,87,89.51,90.6,91,93,93.39,94.82,96.21,96.55,98.16,98.2,98.24,10.6,,Iceland Telecom Ltd.,,Iceland Telecom Ltd.,"Break in comparability, from this year on data based on Eurostat.",ITU estimate based on Eurostat.,Population age 16-74.,Eurostat.,Population age 16-74.,Eurostat.,Population age 16-74.,Eurostat.,Population age 16-74.,Eurostat.,Population age 16-74.,Eurostat.,,Post and Telecom Administration,,Post and Telecom Administration,"Population age 16-74, in the last 3 months.",Post and Telecom Administration, Users in the last 3 months. Age 16-74.,Eurostat., Users in the last 3 months.,Eurostat.,Population age 16-74.,Eurostat.,Population age 16-74.,Eurostat,,ITU estimate.,,ITU Estimate.
India,0.53,0.66,1.54,1.69,1.98,2.39,2.81,3.95,4.38,5.12,7.5,10.07,12.58,15.1,21,26,29.55,10.6,,Department of Telecommunications (DOT). Ministry of Communications and Information Technology.,,Department of Telecommunications (DOT). Ministry of Communications and Information Technology.,,Department of Telecommunications (DOT). Ministry of Communications and Information Technology.,December.,Department of Telecommunications (DOT). Ministry of Communications and Information Technology.,,ITU estimate. ,,ITU estimate. ,September. ,Internet in India [I Cube] Report 2007. ,September. ,"Department of Telecommunications, Ministry of Communications & IT",,"Department of Telecommunications, Ministry of Communications & IT",,"Department of Telecommunications, Ministry of Communications & IT",,ITU estimate.,Estimate based on market research reports indicating 121 million Internet users by 12/2011. India has 20.99  million Internet connections (incl. broad- and narrowband subscript. excl. mobile phone subscript. with data capabilities) in 09/2011.,DoT / TRAI.,,ITU estimate.,,ITU estimate.,,ITU estimate.,,ITU estimate.,,ITU Estimate.
Indonesia,0.93,2.02,2.13,2.39,2.6,3.6,4.76,5.79,7.92,6.92,10.92,12.28,14.52,14.94,17.14,21.98,25.37,10.6,,Indonesian Internet Service Provider Association.,,Indonesian Internet Service Provider Association.,,Indonesian Internet Service Provider Association.,,Indonesian Internet Service Provider Association.,,Indonesian Internet Service Provider Association.,,Indonesian Internet Service Provider Association.,,Indonesian Internet Service Provider Association.,,Indonesian Internet Service Provider Association.,,ITU estimate.,,Ministry of Communication and Information Technology,Refers to total population.,Ministry of Communication and Information Technology,Break in comparability. Population age 5+. (value for all population is 11.11%).,Badan Pusat Statistik., Population age 5+.,BPS-Statistics Indonesia,Population age 5+.,BPS-Statistics Indonesia,Population age 5+.,BPS-Statistics Indonesia,Population age 5+.,BPS-Statistics Indonesia,,BPS-Statistics Indonesia.
Iran (I.R.),0.93,1.48,4.63,6.93,7.49,8.1,8.76,9.47,12.02,13.8,15.9,19,22.73,29.95,39.35,45.33,53.23,10.6,,Ministry of Information and Communications Technology.,,Ministry of Information and Communications Technology.,,Ministry of Information and Communications Technology.,,Communications Regulatory Authority (CRA).,,ITU estimate.,,ITU estimate.,,ITU estimate.,,ITU estimate.,Population age 6+.,Statistical Centre of Iran (SCI),,ITU estimate.,Population age 6+.,Statistical Center of Iran.,,ITU estimate.,Population age 6+.,Statistical Centre of Iran (SCI),Population age 6+.,Statistical Centre of Iran (SCI),Country estimate.,Statistical Centre of Iran (SCI),Country estimate.,Statistical Centre of Iran (SCI),,Statistical Centre of Iran (SCI).
Iraq,,0.1,0.5,0.6,0.9,0.9,0.95,0.93,1,1.06,2.5,5,7.1,9.2,13.21,17.22,21.23,10.6,,,,ITU estimate.,,ITU estimate.,,ITU estimate.,,ITU estimate.,,ITU estimate.,,Ministry of Communications,,Ministry of Communications,,Ministry of Communications,,Ministry of Communications,,Ministry of Communications,,ITU estimate.,,ITU estimate.,,ITU estimate.,,Central Statistical Organization,,ITU estimate.,,ITU Estimate.
Ireland,17.85,23.14,25.85,34.31,36.99,41.61,54.82,61.16,65.34,67.38,69.85,74.89,76.92,78.25,83.49,83.49,85.01,10.6,Population age 15+.,Amarach.,Population age 15+.,Amarach.,age 15+.,Amarach.,Population age 16-74.,Eurostat.,Population age 16-74.,Eurostat.,Population age 16-74.,Eurostat.,Population age 16-74.,Eurostat.,Population age 16-74.,Eurostat.,Population age 16-74.,Eurostat.,"Population age 16-74.
",Eurostat.,"Population age 16-74.
",Eurostat., Users in the last 3 months. Age 16-74.,Eurostat., Users in the last 3 months.,Eurostat.,Population age 16-74.,Eurostat.,Population age 16-74. Last three months.,Eurostat,Population age 16-74. Last three months.,Eurostat.,Population age 16-74. Last three months.,Eurostat.
Israel,20.87,17.38,17.76,19.59,22.77,25.19,27.88,48.13,59.39,63.12,67.5,68.87,70.8,70.25,75.02,77.35,79.65,10.6,,,,,,,,,,,,,,,Population age 20+.,Central Bureau of Statistics.,Population age 20+.,Central Bureau of Statistics.,Population age 20+.,Central Bureau of Statistics.,Population age 20+.,Central Bureau of Statistics,"Age 20+.

in the last 3 months",Central Bureau of Statistics,"Age 20+.

in the last 3 months",Central Bureau of Statistics,Age 20+. in the last 3 months,CENTRAL BUREAU OF STATISTICS,Population age 20+.,CENTRAL BUREAU OF STATISTICS,Population age 20+.,Israel Central Bureau of Statistics,,Israel Central Bureau of Statistics.
Italy,23.11,27.22,28.04,29.04,33.24,35,37.99,40.79,44.53,48.83,53.68,54.39,55.83,58.46,55.64,58.14,61.32,10.6,,IDC.,,IDC.,"Population age 16-74, in the last 3 months.",Eurostat.,Population age 16-74.,Eurostat.,Population age 16-74.,Eurostat.,Population age 16-74.,Eurostat.,Population age 16-74.,Eurostat.,Population age 16-74.,Eurostat.,Population age 16-74.,Eurostat.,Population age 16-74.,Eurostat.,"Population age 16-74.
",Eurostat., Users in the last 3 months. Age 16-74.,Eurostat., Users in the last 3 months.,Eurostat.,Population age 16-74.,Eurostat.,Break in series. Population age 6+.,Istat/ Italian National Institute of Statistics.,Population age 6+.,Istat/ Italian National Institute of Statistics.,Population age 6+.,Istat/ Italian National Institute of Statistics.
Jamaica,3.12,3.86,6.1,7.8,10,12.8,16.4,21.1,23.6,24.3,27.67,37.44,33.79,37.1,40.4,42.22,45,10.6,,Cable & Wireless.,,Cable & Wireless.,,ITU estimate.,,ITU estimate.,,ITU estimate.,,ITU estimate.,,ITU estimate.,,ITU estimate.,,Office of Utilities Regulation,,Office of Utilities Regulation,Population age 14+.,Statistical Institute of Jamaica,Break in comparability. Individuals 3+. Census result.Penetration is estimated by ITU at 31.5 for population 14+.,Statistical Institute of Jamaica,Population age 14+.,Statistical Institute of Jamaica,Population age 14+.,Statistical Institute of Jamaica,Population age 14+.,Statistical Institute of Jamaica,Country estimate.,Statistical Institute of Jamaica (STATIN) ,,ITU Estimate.
Japan,29.99,38.53,46.59,48.44,62.39,66.92,68.69,74.3,75.4,78,78.21,79.05,79.5,88.22,89.11,91.06,93.18,10.6,PC-based only.,Ministry of Internal Affairs and Communications (MIC).,PC-based only.,Ministry of Internal Affairs and Communications (MIC).,PC-based only.,Ministry of Internal Affairs and Communications (MIC).,PC-based only.,Ministry of Internal Affairs and Communications (MIC).,"Incl. users accessing internet through cellphones, PHS and game console.",Ministry of Internal Affairs and Communications (MIC); Telecommunications Carriers Associations (TCA).,Population age 6+.,Ministry of Internal Affairs and Communications.,Population age 6+.,Ministry of Internal Affairs and Communications.,Population age 6+.,Ministry of Internal Affairs and Communications. ,Population age 6+.,Ministry of Internal Affairs and Communications.,Population age 6+.,Ministry of Internal Affairs and Communications.,Population age 6+.,Ministry of Internal Affairs and Communications,Population age 6+.,Ministry of Internal Affairs and Communications,Population age 6+.,Ministry of Internal Affairs and Communications,Population age 6+.,Ministry of Internal Affairs and Communications,Population age 6+.,Ministry of Internal Affairs and Communications,,Ministry of Internal Affairs and Communications ,,Ministry of Internal Affairs and Communications.
Jersey,9.22,16.06,19.41,22.73,30.68,31.25,31.82,32.39,,,,36,41.03,,,,,10.6,,,,,,,,,,,,,,,,ITU estimate.,,,,,,,,ITU estimate.,,ITU estimate.,,,,,,,,
Jordan,2.62,4.71,6.03,8.47,11.66,12.93,13.87,20,23,26,27.2,34.9,37,41.4,46.2,60.11,62.3,10.6,,,,,,,,,,,,,,,,Telecommunications Regulatory Commission.,,ITU estimate.,Population age 5+.,Department of Statistics.,Population age 5+.,Department of Statistics of Jordan,Population age 5+.,Department of Statistics of Jordan,Population age 5+.,Department of Statistics of Jordan,Population age 5+.,Department of Statistics of Jordan,Population age 5+.,Department of Statistics of Jordan,,ITU Estimate.,,ITU Estimate.
Kazakhstan,0.67,1.01,1.67,2,2.65,2.96,3.27,4.02,11,18.2,31.6,50.6,61.91,63.3,66,70.83,74.59,10.6,,,,,,,,,,,,,,,,Ministry of the Republic of Kazakhstan for Communications and Information,,Ministry of the Republic of Kazakhstan for Communications and Information,,Ministry of the Republic of Kazakhstan for Communications and Information,According to annual sample surveys. Population age 16-74.,The Agency of the Republic of Kazakhstan on Statistics,,The Agency of the Republic of Kazakhstan on Statistics,,Agency of the Republic of Kazakhstan on Statistics.,,Agency of the Republic of Kazakhstan on Statistics.,,ITU estimate.,Population age 6-74.,Ministry of National Economy Committee on Statistics. ,,Ministry of National Economy Committee on Statistics. 
Kenya,0.32,0.62,1.21,2.94,3.02,3.1,3.6,4.4,5.2,6.1,7.2,8.8,10.5,13,16.5,21,26,10.6,,,,,,,,,,,,,,ITU estimate.,,ITU estimate.,,ITU estimate.,,Kenya National Bureau of Statistics,,National Bureau of Statistics and Communications Commission of Kenya.,,ITU estimate.,,ITU estimate.,,ITU estimate.,,ITU estimate.,,ITU estimate.,,ITU estimate.
Kiribati,1.79,2.34,2.5,3,3.5,4,4.5,6,7,8.97,9.07,10,10.75,11.5,12.25,13,13.7,10.6,,ITU estimate.,,ITU estimate.,,ITU estimate.,,ITU estimate.,,ITU estimate.,,ITU estimate.,,"NSO, 2006 Kiribati HIES",,ITU estimate.,,ITU estimate.,,Telecommunications Authority of Kiribati,,Telecommunications Authority of Kiribati,,Telecommunications Authority of Kiribati,,ITU estimate.,,ITU estimate.,,ITU estimate.,,ITU estimate.,,ITU Estimate.
Korea (Rep.),44.7,56.6,59.4,65.5,72.7,73.5,78.1,78.8,81,81.6,83.7,83.76,84.07,84.77,87.56,89.65,92.84,10.6,In the last month. Population age 3+.,KRNIC.,In the last month. Population age 3+.,KRNIC.,In the last month. Population age 3+.,NIDA.,In the last month. Population age 3+.,NIDA.,Population age 3+.,KISA.,Population age 3+.,KISA.,Population age 3+.,KISA.,Population age 3+.,KISA.,Population age 3+.,Korea Communications Commission,Population age 3+.,KCC and KISA.,Population age 3+.,Korea Communications Commission,Population age 3+.,Korea Communications Commission (KCC),Population age 3+.,"Ministry of Science, ICT & Future Planning(MSIP)",Population age 3+.,"Ministry of Science, ICT & Future Planning(MSIP)",Population age 16-74.,"Ministry of Science, ICT & Future Planning(MSIP)",Population age 16-74.,"Ministry of Science, ICT and Future Planning",,Ministry of Science and ICT(MSIT).
Kuwait,6.73,8.55,10.25,22.4,22.93,25.93,28.79,34.8,42,50.8,61.4,65.77,70.45,75.46,78.7,77.52,78.37,10.6,,,,,,,,,,,,,,,,ITU estimate.,,ITU estimate.,,ITU estimate.,,ITU estimate.,,Central Statistical Bureau,,ITU estimate.,,ITU estimate.,,ITU estimate.,,ITU estimate.,,ITU Estimate.
Kyrgyzstan,1.04,3,3,3.91,5.09,10.53,12.31,14.03,15.7,16,16.3,17.5,19.8,23,28.3,30.25,34.5,10.6,,,,,,,,,,,,,,,,State Communication Agency under the Government of the Kyrgyz Republic,,,,ITU estimate.,,ITU estimate.,,ITU estimate.,,ITU estimate.,,ITU estimate.,,ITU estimate.,,ITU estimate.,,ITU Estimate.
Lao P.D.R.,0.11,0.18,0.27,0.33,0.36,0.85,1.17,1.64,3.55,6,7,9,10.75,12.5,14.26,18.2,21.87,10.6,,,,,,,,,,,,,,,,National Authority of Post and Telecommunication,,National Authority of Post and Telecommunication,,National Authority of Post and Telecommunication,,National Authority of Post and Telecommunication,,Ministry of Posts and Telecommunications ,,ITU estimate.,,ITU estimate.,,ITU estimate.,,ITU estimate.,,ITU Estimate.
Latvia,6.32,7.22,21.94,26.98,38.58,46,53.63,59.17,63.41,66.84,68.42,69.75,73.12,75.23,75.83,79.2,79.84,10.6,,Ministry of Transport.,,Ministry of Transport.,,ITU estimate.,,ITU estimate.,Population age 16-74.,Eurostat.,Population age 16-74.,Eurostat.,Population age 16-74.,Eurostat.,Population age 16-74.,Eurostat.,Population age 16-74.,Ministry of Transport,Population age 16-74.,Eurostat.,Population age 16-74.,Eurostat., Users in the last 3 months. Age 16-74.,Eurostat., Users in the last 3 months.,Eurostat.,Population age 16-74.,Eurostat.,Population age 16-74.,Eurostat,Population age 16-74.,Eurostat.,,Central Statistical Bureau.
Lebanon,7.95,6.78,7,8,9,10.14,15,18.74,22.53,30.14,43.68,52,61.25,70.5,73,74,76.11,10.6,,Lebanese Broadcasting International.,,Lebanese Broadcasting International.,,ITU estimate. ,,ITU estimate. ,,ITU estimate. ,Population age 6+.,,,ITU estimate. ,,Ministère des Télécommunications,TRA estimates the number of Internet users based on the number of Internet subscriptions (3 users for every subscription). ,Ministère des Télécommunications,Estimate based on population aged 15+.,ITU estimate.,Estimate based on population aged 15+.,ITU estimate.,Population age 15+.,Presidency of the Council of Ministers,,ITU estimate.,,ITU estimate.,,ITU estimate.,,ITU estimate.,,ITU estimate.
Lesotho,0.21,0.26,1.08,1.53,2.18,2.58,2.98,3.45,3.58,3.72,3.86,7,10,15,22,25,27.36,10.6,,Telecomm Lesotho (TCL).,,Telecomm Lesotho (TCL).,,Lesotho Telecommunications Authority (LTA).,,Lesotho Telecommunications Authority (LTA).,,Lesotho Telecommunications Authority (LTA).,,ITU estimate.,,Lesotho Telecommunications Authority (LTA).,,Lesotho Telecommunications Authority (LTA).,,Lesotho Telecommunications Authority,,Lesotho Telecommunications Authority,,ITU estimate.,,ITU estimate.,,ITU estimate.,,ITU estimate.,,ITU estimate.,,ITU estimate.,,Research ICT Africa.
Liberia,0.02,0.03,0.03,0.03,0.03,,,0.55,0.53,2,2.3,2.5,2.6,3.2,5.41,5.9,7.32,10.6,,,,,,,,ITU estimate.,,ITU estimate.,,,,,,ITU estimate.,,ITU estimate.,,ITU estimate.,,Liberia Telecommunications Authority ,,ITU estimate.,,ITU estimate.,,ITU estimate.,,ITU estimate.,,ITU estimate.,,ITU Estimate.
Libya,0.19,0.37,2.24,2.81,3.53,3.92,4.3,4.72,9,10.8,14,14,,16.5,17.76,19.02,20.27,10.6,,Ministry of Transport and Communications.,,Ministry of Transport and Communications.,,Ministry of Transport and Communications.,,Ministry of Transport and Communications.,,Ministry of Transport and Communications.,,ITU estimate.,,ITU estimate.,,Ministry of Transport and Communications.,,ITU estimate.,,ITU estimate.,,ITU estimate.,,ITU estimate.,,,,ITU estimate.,,ITU estimate.,,ITU estimate.,,ITU Estimate.
Liechtenstein,36.52,45.12,59.47,58.81,64.01,63.37,64.21,65.08,70,75,80,85,89.41,93.8,95.21,96.64,98.09,10.6,,,,,,,,,,,,,,,,ITU estimate.,,ITU estimate.,,ITU estimate.,,ITU estimate. ,Estimate.,Office for Communications,,ITU estimate.,,ITU estimate.,,ITU estimate.,,ITU estimate.,,ITU Estimate.
Lithuania,6.43,7.18,17.69,25.91,31.23,36.22,43.9,49.9,55.22,59.76,62.12,63.64,67.23,68.45,72.13,71.38,74.38,10.6,,Lithuanian Telecom.,,Lithuanian Telecom.,Population age 16-74 using Internet in the last 3 months.,Eurostat.,Population age 16-74 using Internet in the last 3 months.,Eurostat.,Population age 16-74 using Internet in the last 12 months.,Eurostat.,Population age 16-74 using Internet in the last 12 months.,Eurostat.,Population age 16-74 using Internet in the last 12 months.,Eurostat.,Population age 16-74 using Internet in the last 12 months.,Eurostat.,Population age 16-74 using Internet in the last 12 months.,Eurostat.,Population age 16-74 using Internet in the last 12 months.,Eurostat.,Population age 16-74 using Internet in the last 12 months.,Statistics Lithuania., Users in the last 3 months. Age 16-74.,Eurostat., Users in the last 3 months.,Eurostat.,Population age 16-74.,Eurostat.,Population age 16-74.,Eurostat,Population age 16-74.,Eurostat.,,Statistics Lithuania.
Luxembourg,22.89,36.16,39.84,54.55,65.88,70,72.51,78.92,82.23,87.31,90.62,90.03,91.95,93.78,94.67,97.33,98.14,10.6,,Institut Luxembourgeois de Régulation.,Population age 12+.,ILRES.,"Population age 16-74, in the last 3 months.",Eurostat.,Population age 16-74.,Eurostat.,Population age 16-74.,Eurostat.,Population age 16-74.,Eurostat.,Population age 16-74.,Eurostat.,Population age 16-74.,Eurostat.,Population age 16-74.,Eurostat and Statec.,Population age 16-74.,Eurostat.,Population age 16-74.,Eurostat., Users in the last 3 months. Age 16-74.,Eurostat., Users in the last 3 months.,Eurostat.,Population age 16-74.,Eurostat.,Population age 16-74.,Eurostat,Population age 16-74.,Eurostat.,,STATEC  (Institut national de la statistique et des études économiques).
"Macao, China",13.61,22.52,25.17,25.74,31.48,34.86,46.4,47.33,49.24,54,55.2,60.2,61.31,65.8,69.78,77.6,81.64,10.6,,Estimated by DSTR.,,Estimated by DSTR.,,Estimated by DSTR.,,Estimated by DSTR.,,Estimated by DSTR.,,Estimated by DSTR.,Population age 3+. (Break in comparability),Statistics and Census Service,Estimated based on survey's results. Population age 3+.,ITU estimate.,Population age 3+.,Statistics and Census Service,Population age 3+.,Statistics and Census Service,Population age 3+.,Statistics and Census Service,last 3 months.,Statisitics and Census Service,Population age 3+.,Statistics and Census Service,Population age 3+.,Statistics and Census Service,Population age 3+.,Statistics and Census Service,Population age 3+.,Statistics and Census Service,,Statistics and Census Service.
Madagascar,0.2,0.22,0.34,0.42,0.53,0.57,0.61,0.65,1.65,1.63,1.7,1.9,2.3,3,3.7,4.17,4.71,10.6,,,,,,,,ITU estimate.,,ITU estimate.,,ITU estimate.,,ITU estimate.,,ITU estimate.,,ITU estimate.,,ITU estimate.,,ITU estimate.,,ITU estimate.,,ITU estimate.,,ITU estimate.,,ITU estimate.,,ITU estimate.,,ITU Estimate.
Malawi,0.13,0.16,0.22,0.28,0.35,0.38,0.43,0.97,0.7,1.07,2.26,3.33,4.35,5.05,5.83,9.3,9.61,10.6,,,,,,,,,,,,,,,,Malawi Communications Regulatory Authority.,,Malawi Communications Regulatory Authority,,Malawi Communications Regulatory Authority,,Malawi Communications Regulatory Authority,,"Malawi Communications Regulatory Authority
",,ITU estimate.,,ITU estimate.,,ITU estimate.,,ITU estimate.,,ITU Estimate.
Malaysia,21.38,26.7,32.34,34.97,42.25,48.63,51.64,55.7,55.8,55.9,56.3,61,65.8,57.06,63.67,71.06,78.79,10.6,,PIKOM.,,PIKOM.,,PIKOM.,,PIKOM.,,PIKOM.,,PIKOM.,,PIKOM.,,Malaysian Communications and Multimedia Malaysia,Refers to total population.,Malaysian Communications and Multimedia Malaysia,Refers to total population.,Malaysian Communications and Multimedia Malaysia,Refers to total population.,Malaysian Communications and Multimedia Commission,Refers to total population.,Malaysian Communications and Multimedia Commission,Refers to total population.,Malaysian Communications and Multimedia Commission,Population age 15+.,Department of Statistics,Population age 15+.,Department of Statistics,Population age 15+.,"Department of Statistics, Malaysia (DOSM)",,Department of Statistics.
