country,2000,2001,2002,2003,2004,2005,2006,2007,2008,2009,2010,2011,2012,2013,2014,2015,2016,,Notes 2000,Source 2000,Notes 2001,Source 2001,Notes 2002,Source 2002,Notes 2003,Source 2003,Notes 2004,Source 2004,Notes 2005,Source 2005,Notes 2006,Source 2006,Notes 2007,Source 2007,Notes 2008,Source 2008,Notes 2009,Source 2009,Notes 2010,Source 2010,Notes 2011,Source 2011,Notes 2012,Source 2012,Notes 2013,Source 2013,Notes 2014,Source 2014,Notes 2015,Source 2015,Notes 2016,Source 2016
Comoros,0.27,0.44,0.55,0.85,1.33,2,2.2,2.5,3,3.5,5.1,5.5,5.98,6.5,6.98,7.46,7.94,10.6,,,,,,,,ITU estimate.,,ITU estimate.,,ITU estimate.,,ITU estimate.,,ITU estimate.,,ITU estimate.,,ITU estimate.,,ITU estimate.,,ITU estimate. ,,ITU estimate.,,ITU estimate.,,ITU estimate.,,ITU estimate.,,ITU Estimate.
Congo (Dem. Rep.),0.01,0.01,0.09,0.13,0.2,0.24,0.3,0.37,0.44,0.56,0.72,1.2,1.68,2.2,3,3.8,6.21,10.6,ITU estimate. ,,,ITU estimate. ,,ITU estimate. ,,ITU estimate. ,,ITU estimate. ,,ITU estimate. ,,ITU estimate. ,,ITU estimate. ,,ITU estimate. ,,ITU estimate. ,Country estimate.,Autorité de Régulation de la Poste et des Télécommunications,,ITU estimate. ,,ITU estimate.,,ITU estimate.,,ITU estimate.,,ITU estimate.,,ITU Estimate.
Congo (Rep.),0.03,0.03,0.16,0.46,1.08,1.46,2.01,2.76,4.29,4.5,5,5.6,6.11,6.6,7.11,7.62,8.12,10.6,,,,,,,,ITU estimate.,,ITU estimate.,,ITU estimate.,,ITU estimate.,,Direction Génerale de l'Administration Centrale des Postes et Télécommunications du Congo.,,Direction Génerale de l'Administration Centrale des Postes et Télécommunications du Congo.,,ITU estimate.,,ITU estimate.,Estimate based on the number of fixed and mobile broadband subscriptions. ,Agence de Régulation des Postes et des Communications Electroniques,,ITU estimate.,,ITU estimate.,,ITU estimate.,,ITU estimate.,,ITU Estimate.
Cook Islands,15.66,18.08,20.02,22.87,23.99,26.2,25.86,25.6,25.41,30.29,35.71,39.03,42,45,48,51,54,10.6,,ITU estimate.,,ITU estimate.,,ITU estimate.,,ITU estimate.,,ITU estimate.,,ITU estimate.,,ITU estimate.,,ITU estimate.,,ITU estimate.,,Telecom Cook Islands Ltd.,,Telecom Cook Islands Ltd.,this figure includes all individuals who have access to the internet at home.,Cook Islands Statistics Office,,ITU estimate.,,ITU estimate.,,ITU estimate.,,ITU estimate.,,ITU Estimate.
Costa Rica,5.8,9.56,19.89,20.33,20.79,22.07,25.1,28.4,32.29,34.33,36.5,39.21,47.5,45.96,53,59.76,66.03,10.6,,,,,,,,,,,Population age 5+.,Instituto Nacional de Estadística y Censos,Estimated based on 2005 and 2008 surveys' results. Population age 5+,ITU estimate.,Estimated based on 2005 and 2008 surveys' results. Population age 5+,ITU estimate.,Population age 5+ using Internet in the last 3 months.,Instituto Nacional de Estadística y Censos,Population age 5+ using Internet in the last 3 months.,ICE-Telecomunicaciones,Population age 5+ using Internet in the last 3 months.,Instituto Nacional de Estadisticas y Censos (INEC),Total population. In the last three months.,Instituto Nacional de Estadisticas y Censos (INEC),In the last 3 months. Population 5+.,Instituto Nacional de Estadisticas y Censos (INEC),Break in comparability. Total population. In the last three months.,Instituto Nacional de Estadisticas y Censos (INEC),,ITU estimate.,Population age 5+ in the last three months.,Instituto Nacional de Estadística y Censos,,Instituto Nacional de Estadística y Censos.
Côte d'Ivoire,0.23,0.4,0.5,0.76,0.85,1.04,1.52,1.8,1.9,2,2.7,2.9,5,12,19.27,21.89,26.53,10.6,,,,,,,,,,,,,,,,ITU estimate.,,ITU estimate.,,ITU estimate.,,ITU estimate.,,ITU estimate.,,ITU estimate.,,ITU estimate.,,ITU estimate.,,ITU Estimate.,,ITU Estimate.
Croatia,6.64,11.56,17.76,22.75,30.91,33.14,37.98,41.44,44.24,50.58,56.55,57.79,61.94,66.75,68.57,69.8,72.7,10.6,,,,,,Croatian Post and Electronic Communications Agency (HAKOM). ,,,,,Population age 16-74.,,Population age 16-74.,,Population age 16-74.,Eurostat.,Population age 16-74.,Croatian Post and Electronic Communications Agency (HAKOM),Population age 16-74.,Croatian Post and Electronic Communications Agency (HAKOM),Population age 16-74.,Croatian Post and Electronic Communications Agency (HAKOM), Users in the last 3 months. Age 16-74.,Eurostat., Users in the last 3 months.,Eurostat.,Population age 16-74.,Eurostat.,Population age 16-74.,Eurostat,Population age 16-74.,Eurostat.,,Eurostat.
Cuba,0.54,1.08,3.77,5.24,8.41,9.74,11.16,11.69,12.94,14.33,15.9,16.02,21.2,27.93,29.07,37.31,38.77,10.6,Refers only to users with access to the international network.,Ministerio de la Informática y las Comunicaciones.,Refers only to users with access to the international network.,Ministerio de la Informática y las Comunicaciones.,Incl. users of the international network and also those having access only to the Cuban network.,ONE.,Incl. users of the international network and also those having access only to the Cuban network.,ONE.,Incl. users of the international network and also those having access only to the Cuban network.,ONE.,Incl. users of the international network and also those having access only to the Cuban network.,ONE.,Incl. users of the international network and also those having access only to the Cuban network.,ONE.,Incl. users of the international network and also those having access only to the Cuban network.,Ministerio de la Informática y las Comunicaciones,Incl. users of the international network and also those having access only to the Cuban network.,Ministerio de la Informática y las Comunicaciones,Incl. users of the international network and also those having access only to the Cuban network. Users of international network account for 2.9%.,Ministerio de la Informática y las Comunicaciones,Incl. users of the international network and also those having access only to the Cuban network.,Ministerio de la Informática y las Comunicaciones,Population age 6+. Incl. users of the international network and also those having access only to the Cuban network.,Oficina Nacional de Estadisticas (ONE),,ITU estimate.,Population age 6+. Incl. users of the international network and also those having access only to the Cuban network.,Oficina Nacional de Estadisticas (ONE),Population age 6+.,Oficina Nacional de Estadisticas e Información (ONEI),Population age 6+.,Oficina Nacional de Estadística e Información (ONEI),,ITU Estimate.
Cyprus,15.26,18.82,28.32,30.09,33.83,32.81,35.83,40.77,42.31,49.81,52.99,56.86,60.69,65.45,69.33,71.72,75.9,10.6,,ESIS.,,ESIS.,,ESIS. ESIS. ESIS.,,ITU estimate based on Eurostat.,Population age 16-74.,Eurostat,Population age 16-74.,Eurostat.,Population age 16-74.,Eurostat.,Population age 16-74.,Eurostat.,Population age 16-74.,Eurostat.,Population age 16-74.,Eurostat.,"Population age 16-74.
",Eurostat., Users in the last 3 months. Age 16-74.,Eurostat., Users in the last 3 months.,Eurostat.,Population age 16-74.,Eurostat.,Population age 16-74.,Eurostat,Population age 16-74.,Eurostat.,,Statistical Service of Cyprus.
Czech Republic,9.78,14.7,23.93,34.3,35.5,35.27,47.93,51.93,62.97,64.43,68.82,70.49,73.43,74.11,74.23,75.67,76.48,10.6,,Ministry of Economy. Czech Telecommunication Office.,,Ministry of Economy. Czech Telecommunication Office.,,Ministry of Economy. Czech Telecommunication Office estimate.,Population age 16-74.,Eurostat,Population age 16-74.,Eurostat,Population age 16-74.,Eurostat.,Population age 16-74.,Eurostat.,Population age 16-74.,Eurostat.,Population age 16-74.,Eurostat.,Population age 16-74.,Eurostat.,Population age 16-74.,Eurostat., Users in the last 3 months. Age 16-74.,Eurostat., Users in the last 3 months.,Eurostat.,Population age 16-74.,Eurostat.,Population age 16+.,Czech Statistical Office.,Population age 16+.,Czech Statistical Office.,Population age 16+.,Czech Statistical Office.
D.P.R. Korea,0,0,0,0,0,0,0,0,0,0,0,0,0,,,,,10.6,Commercially not available. Local Intranet available in country.,Ministry of Posts and Telecommunications.,Commercially not available. Local Intranet available in country.,Ministry of Posts and Telecommunications.,Commercially not available. Local Intranet available in country.,Ministry of Posts and Telecommunications.,Commercially not available. Local Intranet available in country.,Ministry of Posts and Telecommunications.,Commercially not available. Local Intranet available in country.,Ministry of Posts and Telecommunications.,Commercially not available. Local Intranet available in country.,Ministry of Posts and Telecommunications.,Commercially not available. Local Intranet available in country.,Ministry of Posts and Telecommunications.,Commercially not available. Local Intranet available in country.,Ministry of Posts and Telecommunications.,,Ministry of Posts and Telecommunications.,,ITU estimate.,,ITU estimate.,,ITU estimate.,,ITU estimate.,,,,,,,,
Denmark,39.17,42.96,64.25,76.26,80.93,82.74,86.65,85.03,85.02,86.84,88.72,89.81,92.26,94.63,95.99,96.33,96.97,10.6,E-mail users.,MR&IT.,,ITU estimate.,Population age 16-74 using Internet in the last 3 months.,Eurostat.,Population age 16-74.,Eurostat.,Population age 16-74.,Eurostat.,Population age 16-74.,Eurostat.,Population age 16-74.,Eurostat.,Population age 16-74.,Eurostat.,Population age 16-74.,Eurostat.,Population age 16-74.,Eurostat.,"Population age 16-74.
",National IT- and Telecom Agency NITA, Users in the last 3 months. Age 16-74.,Eurostat., Users in the last 3 months.,Eurostat.,Population age 16-74.,Eurostat.,Population age 16-74.,Eurostat,Population age 16-74.,Eurostat.,,Statistics Denmark.
Djibouti,0.19,0.34,0.49,0.63,0.78,0.95,1.27,1.62,2.26,4,6.5,7,8.27,9.5,10.71,11.92,13.13,10.6,,,,,,,,,,,,,,,,"Ministére de la Communication et de la Culture, chargé des Postes et des Télécommunications",,"Ministére de la Communication et de la Culture, chargé des Postes et des Télécommunications",,ITU estimate. ,,ITU estimate. ,,ITU estimate. ,,ITU estimate.,,ITU estimate.,,ITU estimate.,,ITU estimate.,,ITU Estimate.
Dominica,8.81,13.25,18.42,23.62,30.32,38.54,39.4,40.27,41.16,42.02,47.45,48.6,49.8,51,57.5,65,67.03,10.6,,,,,,,,ITU estimate.,,ITU estimate.,,ITU estimate.,,ITU estimate.,,ITU estimate.,,ITU estimate.,,ITU estimate.,,National Telecommunications Regulatory Commission,,ITU estimate.,,ITU estimate.,,ITU estimate.,,ECTEL,,ITU Estimate.,,ITU Estimate.
Dominican Rep.,3.7,4.43,6.82,7.9,8.87,11.48,14.84,17.66,20.82,27.72,31.4,38,42.32,45.9,49.58,54.22,61.33,10.6,,Instituto Dominicano de las Telecomunicaciones (INDOTEL).,,Instituto Dominicano de las Telecomunicaciones (INDOTEL).,,Instituto Dominicano de las Telecomunicaciones (INDOTEL).,,Instituto Dominicano de las Telecomunicaciones (INDOTEL).,,Instituto Dominicano de las Telecomunicaciones (INDOTEL).,,Instituto Dominicano de las Telecomunicaciones (INDOTEL).,,Instituto Dominicano de las Telecomunicaciones (INDOTEL).,,Instituto Dominicano de las Telecomunicaciones (INDOTEL),,Instituto Dominicano de las Telecomunicaciones (INDOTEL),Calculated using a multiplying factor of 3.9 to residencial subscriptions and 16 to business subscriptions.,Instituto Dominicano de las Telecomunicaciones (INDOTEL),,ITU estimate.,12+ years.,Oficina Nacional Estadistica.,12+ years,Oficina Nacional de Estadistica,12+ years,Oficina Nacional de Estadistica,,ITU estimate.,Population age 12+.,Oficina Nacional de Estadistica,,ITU Estimate.
Ecuador,1.46,2.67,4.26,4.46,4.83,5.99,7.2,10.8,18.8,24.6,29.03,31.37,35.14,40.28,45.59,48.94,54.06,10.6,,,,,,,,,,,,ITU estimate.,Population age 10+.,ITU estimate.,Estimated based on survey results.,ITU estimate.,,Secretaría Nacional de Telecomunicaciones (SENATEL),"Population age 5+ (Source: INEC, households survey)",Secretaría Nacional de Telecomunicaciones (SENATEL),Population age 5+.,Instituto Nacional de Estadistica y Censos,Population age 5+.,Instituto Nacional de Estadistica y Censos - INEC,Population age 5+.,INSTITUTO NACIONAL DE ESTADISTICA Y CENSOS - INEC,Population age 5+. Direct respondent as of 15.,Instituto Nacional de Estadistica y Censos,Population age 5+,Instituto Nacional de Estadistica y Censos,Population age 5+.,Instituto Nacional de Estadistica y Censos,,Instituto Nacional de Estadistica y Censos.
Egypt,0.64,0.84,2.72,4.04,11.92,12.75,13.66,16.03,18.01,20,21.6,25.6,26.4,29.4,33.89,37.82,41.25,10.6,,Telecom Egypt estimate.,,Telecom Egypt estimate.,,MICT.,,Telecom Egypt estimate.,,Ministry of Communications and Information Technology.,,Ministry of Communications and Information Technology.,,Ministry of Communications and Information Technology.,,Ministry of Communcations and Information Technology,,Ministry of Communications and Information Technology,,ITU estimate.,Population age 6+.,Ministry of Communications and Information Technology,Population age 6+.,Ministry of Communications and Information Technology,Population age 6+.,central agency for public mobilization and statistics-capmas,Population age 6+.,Ministry of Communications and Information Technology,Population age 6+.,Ministry of Communications and Information Technology,Population age 6+.,Central Agency For Public Mobilization And Statistics (CAPMAS),,Central Agency For Public Mobilization And Statistics (CAPMAS).
El Salvador,1.18,1.5,1.9,2.5,3.2,4.2,5.5,6.11,10.08,12.11,15.9,18.9,20.32,23.11,24.76,26.8,29,10.6,,Superintendencia General de Electricidad y Telecomunicaciones.,Estimated based on Survey results. Population age 10+.,ITU estimate.,Estimated based on Survey results. Population age 10+.,ITU estimate.,Estimated based on Survey results. Population age 10+.,ITU estimate.,Estimated based on Survey results. Population age 10+.,ITU estimate.,Estimated based on Survey results. Population age 10+.,ITU estimate.,Population age 10+.,"OSILAC, ECLAC.",Population age 10+.,DIGESTYC,Population age 10+.,DIGESTYC,Population age 10+.,DIGESTYC,Population age 10+.,DIGESTYC,,ITU estimate.,,Dirección General de Estadística y Censos. (DIGESTYC),In the last 12 months. Individuals aged 10 and above.,Dirección General de Estadística y Censos. (DIGESTYC),Population age 10+.,Dirección General de Estadística y Censos. (DIGESTYC),,Dirección General de Estadística y Censos. (DIGESTYC).,,ITU Estimate.
Equatorial Guinea,0.13,0.17,0.32,0.52,0.84,1.15,1.28,1.56,1.82,2.13,6,11.5,13.94,16.4,18.86,21.32,23.78,10.6,,,,,,,,,,,,,,,,ITU estimate.,,ITU estimate.,,ITU estimate.,,La Société Anonyme de Télécommunications de la République de Guinée Equatoriale,,ITU estimate.,,ITU estimate.,,ITU estimate.,,ITU estimate.,,ITU estimate.,,ITU Estimate.
Eritrea,0.14,0.16,0.23,,,,,0.41,0.47,0.54,0.61,0.7,0.8,0.9,0.99,1.08,1.18,10.6,,,,,,,,,,,,,,,,ITU estimate.,,ITU estimate.,,ITU estimate.,,ITU estimate.,,ITU estimate.,,ITU estimate,,ITU estimate.,,ITU estimate.,,ITU estimate.,,ITU Estimate.
Estonia,28.58,31.53,41.52,45.32,53.2,61.45,63.51,66.19,70.58,72.5,74.1,76.5,78.39,80,84.24,88.41,87.24,10.6,,Ministry of Economic Affairs and Communications.,,Ministry of Economic Affairs and Communications.,,Ministry of Economic Affairs and Communications estimate.,,Ministry of Economic Affairs and Communications estimate.,Population age 16-74.,Eurostat.,Population age 16-74.,Eurostat.,Population age 16-74.,Eurostat.,Population age 16-74.,Eurostat.,Population age 16-74.,Eurostat.,Population age 16-74.,Eurostat.,Population age 16-74 in the last 3 months.,Estonian Competition Authority, Users in the last 3 months. Age 16-74.,Eurostat., Users in the last 3 months.,Eurostat.,Population age 16-74.,Eurostat.,Population age 16-74.,Statistical Office of Estonia.,Population age 16-74.,Statistical Office of Estonia.,,Statistical Office of Estonia.
Ethiopia,0.02,0.04,0.07,0.11,0.16,0.22,0.31,0.37,0.45,0.54,0.75,1.1,2.9,4.6,7.7,13.86,15.37,10.6,,Ethiopian Telecommunications Corporation (ETC). Ethiopian Telecommunication Agency.,,Ethiopian Telecommunications Corporation (ETC). Ethiopian Telecommunication Agency.,,Ethiopian Telecommunications Corporation (ETC). Ethiopian Telecommunication Agency.,,Ethiopian Telecommunications Corporation (ETC). Ethiopian Telecommunication Agency.,,Ethiopian Telecommunications Corporation (ETC). Ethiopian Telecommunication Agency.,,Ethiopian Telecommunications Corporation (ETC). Ethiopian Telecommunication Agency.,,Ethiopian Telecommunications Corporation (ETC). Ethiopian Telecommunication Agency.,,Ethiopian Telecommunication Agency,,ITU estimate.,,ITU estimate.,,ITU estimate.,,ITU estimate.,,ITU estimate.,,ITU estimate.,,ITU estimate.,,Ministry of Communications and Information Technology.,,Ministry of Communications and Information Technology.
Falkland (Malvinas) Is.,58.62,64.6,64.15,64.02,67.32,84.01,87.1,90.06,92.96,95.84,95.84,96.38,96.92,96.9,97.6,98.31,99.02,10.6,,,,,,,,ITU estimate.,,ITU estimate.,,ITU estimate.,,ITU estimate.,,Cable & Wireless South Atlantic Ltd,,Cable & Wireless,,Cable & Wireless,,Cable & Wireless,,Cable & Wireless,,ITU estimate.,,ITU estimate.,,ITU estimate.,,ITU estimate.,,ITU Estimate.
Faroe Islands,32.92,43.25,53.3,58.91,66.53,67.9,69.36,75.98,75.57,75.18,75.2,80.73,85.34,90,93.3,94.2,95.11,10.6,,,,,,,,ITU estimate.,,ITU estimate.,,ITU estimate.,,ITU estimate.,,Post and Telecom Surveillance Authority,,Post and Telecom Surveillance Authority,,Post and Telecom Surveillance Authority,,Post and Telecom Surveillance Authority,,ITU estimate.,,ITU estimate.,,ITU estimate.,,ITU estimate.,,ITU estimate.,,ITU Estimate.
Fiji,1.5,1.86,6.15,6.73,7.41,8.45,9.6,10.9,13,17,20,28,33.74,35.2,37.4,42.5,46.51,10.6,,Telecom Fiji.,,Telecom Fiji.,,Telecom Fiji.,,Telecom Fiji.,,"Ministry of Information, Communications & Media Relations.",,"Ministry of Information, Communications & Media Relations.",,"Ministry of Information, Communications & Media Relations.",,ITU estimate.,,ITU estimate.,,ITU estimate.,,ITU estimate.,,ITU estimate. ,,ITU estimate.,,ITU estimate.,,ITU estimate.,,ITU estimate.,,ITU Estimate.
Finland,37.25,43.11,62.43,69.22,72.39,74.48,79.66,80.78,83.67,82.49,86.89,88.71,89.88,91.51,86.53,86.42,87.7,10.6,Has used at least one other Internet application besides e-mail in last 3 months. Population age 15+.,www.toy.fi.,Using at least one other Internet application besides e-mail in last 3 months. Population age 15+.,www.toy.fi.,Population age 16-74 using Internet in the last 3 months.,Eurostat.,Population age 16-74.,Eurostat.,Population age 16-74.,Eurostat.,Population age 16-74.,Eurostat.,Population age 16-74.,Eurostat.,Population age 16-74.,Eurostat.,Population age 16-74.,Eurostat.,Population age 16-74 using Internet in the last 3 months.,Eurostat.,"Population age 16-74.
",Eurostat., Users in the last 3 months. Age 16-74.,Eurostat., Users in the last 3 months.,Eurostat.,Population age 16-74.,Eurostat.,Break in series. Population aged 16-89.,Statistics Finland.,Population aged 16-89.,Statistics Finland.,Population aged 16-89.,Statistics Finland.
France,14.31,26.33,30.18,36.14,39.15,42.87,46.87,66.09,70.68,71.58,77.28,77.82,81.44,81.92,83.75,84.69,85.62,10.6,Population age 15+ using internet in the last year.,Médiamétrie.,"Population age 11+, used in the last month.",Médiamétrie.,"Population age 11+, used in the last month.",Médiamétrie.,"Population age 11+, used in the last month.",Médiamétrie.,"Population age 11+, used in the last month.",Médiamétrie.,"Population age 11+, used in the last month.",Médiamétrie.,Population age 16-74.,Eurostat.,Population age 16-74.,Eurostat.,Population age 16-74.,Eurostat.,Population age 16-74.,Eurostat.,Population age 16-74.,Eurostat., Users in the last 3 months. Age 16-74.,Eurostat., Users in the last 3 months.,Eurostat.,Population age 16-74.,Eurostat.,Population age 16-74.,Eurostat,Population age 16-74.,Eurostat.,,Eurostat.
French Guiana [included in France data],9.69,11.62,13.92,16.55,19.5,20.79,22.06,23.31,24.53,25.7,,,,,,,,10.6,,,,,,,,,,,,,,ITU estimate.,,ITU estimate.,,ITU estimate.,,ITU estimate.,,,,,,,,,,,,,,
French Polynesia,6.36,6.25,8.2,14.12,17.88,21.54,25.11,28.59,33.87,44.6,49,49,52.88,56.8,60.68,64.56,68.44,10.6,,,,,,,,,,,,,,,,Service des postes et télécommunications,,Service des postes et télécommunications,,Service des postes et télécommunications,,Service des Postes et Télécommunications,,ITU estimate. ,,ITU estimate.,,ITU estimate.,,ITU estimate.,,ITU estimate.,,ITU Estimate.
Gabon,1.22,1.35,1.94,2.66,2.98,4.89,5.49,5.77,7.5,9.5,13,18,24,30.54,38.07,45.78,48.05,10.6,,Office des postes et des télécommunications (OPT).,,Office des postes et des télécommunications (OPT).,,Gabon Telecom S.A.,,Gabon Telecom S.A.,,Gabon Telecom S.A.,,Gabon Telecom S.A.,,Gabon Telecom S.A.,,ITU estimate.,,ITU estimate.,,ITU estimate.,,ITU estimate.,,ITU estimate.,,ITU estimate.,,ITU estimate.,,ITU estimate.,,ITU Estimate.,,ITU Estimate.
Gambia,0.92,1.34,1.8,2.44,3.31,3.8,5.24,6.21,6.88,7.63,9.2,10.87,12.45,14,15.56,16.5,18.5,10.6,,The Gambia Public Utilities Regulatory Authority.,,The Gambia Public Utilities Regulatory Authority.,,The Gambia Public Utilities Regulatory Authority.,,The Gambia Public Utilities Regulatory Authority.,,The Gambia Public Utilities Regulatory Authority.,,ITU estimate.,,The Gambia Public Utilities Regulatory Authority.,,The Gambia Public Utilities Regulatory Authority.,,ITU estimate.,,ITU estimate.,,The Gambia Public Utilities Regulatory Authority,,ITU estimate.,,ITU estimate.,,ITU estimate.,,ITU estimate.,,ITU estimate.,,ITU Estimate.
Georgia,0.48,0.99,1.59,2.56,3.89,6.08,7.53,8.26,10.01,20.07,26.9,31.52,36.94,43.3,44,47.57,58.01,10.6,,Ministry of Communications.,,Georgian National Communications Commission (GNCC).,,Georgian National Communications Commission (GNCC).,,Georgian National Communications Commission (GNCC).,,Georgian National Communications Commission (GNCC).,,ITU estimate.,,Georgian National Communications Commission (GNCC).,,Georgian National Communications Commission,,ITU estimate.,,ITU estimate.,,Ministry of Economy and Sustainable Development of Georgia,,ITU estimate.,,ITU estimate.,Population age 6+ in the last 12 months.,National Statistics Office of Georgia,"Survey value is 49.1% for population age 6+ using Internet in the last 12 months. The current value is an ITU estimate provided for comparability reasons with 2015 value, which corresponds to users in the last 3 months.",ITU estimate.,"Population age 6+. Break in comparability, reference period in the last 3 months.",National Statistics Office of Georgia (Geostat),,National Statistics Office of Georgia (Geostat).
Germany,30.22,31.65,48.82,55.9,64.73,68.71,72.16,75.16,78,79,82,81.27,82.35,84.17,86.19,87.59,89.65,10.6,,(N)onliner-Atlas.,,(N)onliner-Atlas.,Population age 16-74 using Internet in the last 3 months.,Eurostat.,Population age 16-74.,Eurostat.,Population age 16-74.,Eurostat.,Population age 16-74.,Eurostat.,Population age 16-74.,Eurostat.,Population age 16-74.,Eurostat.,Population age 16-74.,Eurostat.,Population age 16-74.,Eurostat.,Population age 16-74.,Eurostat., Users in the last 3 months. Age 16-74.,Eurostat., Users in the last 3 months.,Eurostat.,Population age 16-74.,Eurostat.,Population age 16-74.,Eurostat,Population age 16-74.,Eurostat.,,Eurostat.
Ghana,0.15,0.2,0.83,1.19,1.72,1.83,2.72,3.85,4.27,5.44,7.8,9,10.6,15,25.52,31.45,34.67,10.6,,Ghana Telecom.,,Ghana Telecom estimate.,,National Communications Authority (NCA).,,National Communications Authority (NCA).,,National Communications Authority (NCA).,,National Communications Authority (NCA).,,National Communications Authority (NCA).,,National Communications Authority,,National Communications Authority,,National Communications Authority,Break in comparability: persons 12 years and older. Based on Census 2010 results.,Ghana Statistical Service.,,ITU estimate.,Ghana Living Standards Survey 2012/2013. The estimate is based on weighting households who use internet by the household size over the total estimated population. Sample weights have also been applied. The question was asked at household level.,Ghana Statistical Service,,ITU estimate.,,ITU estimate.,,ITU Estimate.,,ITU Estimate.
Gibraltar,19.13,21.17,23.67,28.33,32.89,39.07,45.3,51.61,58,65.07,65,65,65.02,,,,94.44,10.6,,GNC Networks Limited.,,GNC Networks Limited.,,ITU estimate. ,,ITU estimate. ,,ITU estimate. ,,ITU estimate. ,,ITU estimate. ,,Gibraltar Regulatory Authority,,ITU estimate.,,ITU estimate.,,Gibraltar Regulatory Authority,,Gibraltar Regulatory Authority,,ITU estimate.,,,,,,,,ITU Estimate.
Greece,9.14,10.94,14.67,17.8,21.42,24,32.25,35.88,38.2,42.4,44.4,51.65,55.07,59.87,63.21,66.84,69.09,10.6,,Hellenic Telecommunications & Post Commission (EETT).,,Hellenic Telecommunications & Post Commission (EETT).,"Population age 16-74, in the last 3 months.",Eurostat.,Population age 16-74.,Eurostat.,Population age 16-74.,Eurostat.,Population age 16-74.,Eurostat.,Population age 16-74.,Eurostat.,Population age 16-74.,Eurostat.,Population age 16-74.,Hellenic Telecommunications & Post Commission and EL.STAT,Population age 16-74.,Hellenic Telecommunications & Post Commission,Population age 16-74.,Hellenic Telecommunications & Post Commission and EL.STAT, Users in the last 3 months. Age 16-74.,Eurostat., Users in the last 3 months.,Eurostat.,Population age 16-74.,Eurostat.,Population age 16-74.,Eurostat,Population age 16-74.,Eurostat.,,Hellenic Statistical Authority.
Greenland,31.75,35.46,44.15,54.53,56.1,57.7,59.36,61.07,62.82,62.83,63,64,64.9,65.8,66.7,67.6,68.5,10.6,,,,,,,,,,,,,,,,TELE Greenland,,TELE Greenland,,TELE Greenland,,Tele Greenland A/S,,Tele Greenland A/S,,ITU estimate.,,ITU estimate.,,ITU estimate.,,ITU estimate.,,ITU Estimate.
Grenada,4.06,5.13,14.76,18.65,19.57,20.49,21.4,22.29,23.18,24.05,27,30,32,35,51.6,53.81,55.86,10.6,,,,,,,,ITU estimate.,,ITU estimate.,,ITU estimate.,,ITU estimate.,,Cable & Wireless Grenada Ltd. trading as LIME,,ITU estimate.,,ITU estimate.,,ITU estimate.,,ITU estimate.,,ITU estimate.,,ITU estimate.,,ECTEL,,ITU estimate.,,ITU Estimate.
Guadeloupe [included in France data],5.83,9.2,11.35,14.12,17.51,18.66,19.83,21.02,22.22,23.42,,,,,,,,10.6,,,,,,,,,,,,,,ITU estimate.,,ITU estimate.,,ITU estimate.,,ITU estimate.,,,,,,,,,,,,,,
